{
  "schema_version": "1.0", "candidate_id": "cand_001", "window": {"start": "2026-08-29T14:00:00Z", "end": "2026-08-29T14:05:00Z"}, "slice": {"provider_id": "stripe", "country": "BR"}, "metric": "APPROVAL_RATE", "observed": 0.5102, "expected": 0.84, "sample_size": 492, "effect_absolute": -0.3298, "effect_relative": -0.3926, "statistical_strength": 0.97, "lost_approvals": 162.26, "loss_coverage": 0.91, "temporal_consistency": 0.94, "data_quality": 0.98, "evidence_refs": ["duckdb://window/current"], "detector_version": "1.0", "correlation_id": "corr_window_001"
}
